{
  "$schema": "https://json-schema.org/draft/2020-12/schema",
  "$id": "https://ai-security.io/schemas/service-reference.json",
  "title": "Service reference",
  "description": "Registration of an in-house service. One file per service under schemas/service-references/.",
  "type": "object",
  "required": ["name", "spiffe", "source_digest"],
  "properties": {
    "name": {
      "type": "string",
      "pattern": "^[a-z][a-z0-9-]*$",
      "description": "Service name as referenced by allowed_responses.service in prompt files."
    },
    "spiffe": {
      "type": "string",
      "pattern": "^spiffe://[^/]+/.+",
      "description": "Expected SPIFFE URI of the service. Mesh authz keys on this identity."
    },
    "source_digest": {
      "type": "string",
      "pattern": "^sha256:[0-9a-f]{64}$",
      "description": "OCI digest of the service's mcp-schema.json artifact. Bundle builder pulls + verifies + embeds at this digest."
    },
    "description": {
      "type": "string"
    }
  },
  "additionalProperties": false
}
